"KQ2090010","10","100","受注承認一覧","Appr for order list",
"KU2120010","10","100","仕入直送実績承認一覧","The list of stocking direct deliv results Appr",
"AD3020011","10","100","品目別作業計画メンテナンス(製番)サブ1の「品目別仕掛」一覧","The ""WIP by item""list of  the work planning maintenance by item(PN) sub1",
"AD3030020","10","100","系列別作業計画メンテナンスの「作業系列別仕掛」一覧","The ""WIP by WS"" list of the work planning maintenance by seq",
"AD3030030","10","1000","作業指示確定実行の一覧","The list of WI confirmed EXEC",
"AD3030040","10","1000","作業指示書発行の作業指示一覧","The WI list of issued  work instruction",
"AD3040010","10","100","作業実績メンテナンスの「作業実績一覧」（上段）","The ""work actual list ""(top) of actual work maintenance",
"AD3040010","11","100","作業実績メンテナンスの「使用子品目一覧」（下段）","The ""using component part list""(bottom) of actual work maintenance",
"AD3040010","20","100","作業実績メンテナンスサブ1の「不良理由一覧」","The ""defective reason list"" of actual work maintenance sub1",
"AD3050010","10","100","出来高実績入力の「使用子部品一覧」","The ""using component parts list"" of actual amount actual input",
"AD3070010","10","1000","作業指示一覧の画面リスト","The screen list of WI list",
"AE3030010","10","1000","発注指示確定（一括）の画面リスト","The screen list of order instruction confirmed (batch)",
"AE3030020","10","1000","注文書発行（一括）の画面リスト","The screen list of order sheet issue (batch)",
"AE3040010","10","1000","購買ＥＤＩ注文データ作成の画面リスト","The screen list of purch EDI order data creation",
"AE3040030","10","1000","購買ＥＤＩ所要データ作成の画面リスト","The screen list of purch EDI Rqrmnt data creation",
"AE3060020","10","100","受入実績メンテナンスの「受入実績一覧」（上段）","The ""accept actual list"" (top) of accept actual maintenance",
"AE3060020","11","1000","受入実績メンテナンスの「支給品使用実績一覧」（下段）","The""actual supplies usage list"" (bottom) of accept actual maintenance",
"AE3060030","10","100","検査実績入力の画面リスト","The screen list of inspec actual input",
"AE3110010","10","1000","有償支給履歴一覧の画面リスト","The screen list of chargeable supply history list",
"AE3130010","10","1000","購入返品実績一覧の画面リスト","The screen list of purchase returned goods actual list",
"AE3140010","10","1000","検査実績一覧の画面リスト","The screen list of inspec actual list",
"AE3080010","10","1000","購買ＥＤＩ注文取消データ作成の画面リスト","The screen list of purch EDI order cancel data creation",
"AE3070010","10","1000","注文取消書発行の画面リスト","The screen list of order CAN sheet issue",
"AA3120010","10","100","為替レート情報メンテナンスの画面リスト","The screen list of exchange rate Info maintenance",
"AA3140010","10","100","購入単価一覧の画面リスト","The screen list of purchase unit cost list",
"AF3010010","10","1000","出庫指示一覧の画面リスト","The screen list of II list",
"AF3020010","10","100","マニュアル出庫実績入力の親画面リスト","The parent screen list of manual issue actual input",
"AF3030010","10","0","キット出庫実績入力の親画面リスト","The parent screen list of kit issue actual input",
"AF3040010","10","0","追加出庫実績入力の親画面リスト","The parent screen list of add issue actual input",
"AF3060010","10","1000","保管区移動実績入力（入庫）の親画面リスト","The parent screen list of SS dislodging actual input (receipt)",
"AF3080010","10","100","戻入実績入力の親画面リスト","The parent screen list of actual return input",
"AG3010010","10","1000","在庫照会の子画面リスト","The sub-screen list of stock reference",
"AG3020010","10","1000","入出庫一覧の画面リスト","The screen list of GM list",
"AG3040010","10","1000","在庫一覧の画面リスト","The screen list of stock List",
"AG3050010","10","1000","時系列入出庫予定一覧のリスト","The list of time seq GM sched list",
"AZ3040010","10","1000","一般検索 クエリのリスト","The list of general retrieval query",
"AZ3040010","50","1000","一般検索 検索結果のリスト","The list of general retrieval results",
"AH3020010","20","100","棚卸条件 保管区別棚卸設定のリスト","The list of inventory conditions  SS inventory configuration",
"AH3020010","30","100","棚卸条件 品目別棚卸設定のリスト","The list of inventory conditions item inventory configuration",
"AH3050010","10","1000","実棚入力 親画面リスト","The parent screen list of actual inventory input",
"AH3060010","10","1000","実棚一覧表 画面リスト","The screen list of actual inventory chart list",
"AE3090020","10","1000","発注残一覧の画面リスト","The screen list of stock on order list",
"AJ3010010","10","1000","オーダ別進捗一覧の画面リスト","The screen list of progress list by order",
"AJ3020010","10","1000","製番別進捗一覧の画面リスト","The screen list of progress list by PN",
"AJ3030010","10","100","作業指示進捗一覧の画面リスト","The screen list of progress list by WI",
"AJ3040010","10","100","発注指示進捗一覧の画面リスト","The screen list of  progress list by order instruction",
"AZ3030010","10","1000","業務メッセージ一覧の親画面リスト","The parent screen list of business message list",
"KQ3030010","10","1000","内示受注IFメンテナンス","Unofficial notification order IF maintenance",
"KQ3040010","10","1000","確定受注IFメンテナンス","Confirmed order IF maintenance",
"KQ3100010","10","100","デポ計画メンテナンスデータ一覧","Depo planning maintenance data list",
"KQ3150010","10","1000","受注一覧","Order List",
"KU3010010","10","100","デポ出荷便設定","Depo ship mail set",
"KU3030010","10","1000","出荷指示メンテナンス","S.I. maintenance",
"KU3060010","10","1000","出荷指示一覧","S.I. list",
"KU3090010","10","100","出荷照合","Shipment collation",
"KU3130010","10","1000","出荷実績メンテナンス","Shipping actual maintenance",
"KR3060010","10","100","売上計上","Sales appropriation",
"AF3120010","10","100","オーダ問合せ","Order inquiry",
"AF3040010","20","100","追加出庫実績入力のサブ2画面ロット別在庫リスト（上段）","The sub2 screen stock by lot list (top) of add issue actual input ",
"AF3040010","21","100","追加出庫実績入力のサブ2画面出庫実績明細リスト（下段）","The sub2 screen issue actual details list (bottom) of add issue actual input ",
"AF3080010","20","100","ロット別在庫一覧","The list of stock by lot",
"AF3030010","20","100","キット出庫実績(ロット別在庫一覧)","Kit performance issue (list of stock by lot)",
"AF3030010","21","100","キット出庫実績(実績 明細一覧)","Kit performance issue (actual detailed list)",
"AG3070010","10","100","ロットトレース参照の画面リスト","The screen list of lot trace reference",
"AG3080010","10","100","ロット実績参照の画面リスト","The screen list of actual lot reference",
"AE3150010","10","1000","購買検収承認一覧","Appr for purch receiving check list",
"AZ3060010","10","100","マスタ系承認一覧","Appr for master system list",
"KQ3160010","10","100","受注承認一覧","Appr for order list",
"KQ3170010","10","100","確定受注一覧","Confirmed order list",
"KQ3170010","20","100","製番明細一覧","PN detailed list",
"AD3090010","10","15","作業実績入力(不良理由コード一覧)","Actual work input (defective reason code list)",
"AC3170010","10","1000","所要量アラーム情報参照の画面リスト","The screen list of MR alarm information reference",
"AA3230010","10","100","手配先情報メンテナンス","Arrange destination information maintenance",
"AA3240010","10","100","手配先展開情報メンテナンス","Arrange destination expansion information maintenance",
"AA3250010","10","100","払出先別オーダリングメンテナンス","Ordering maintenance by issue destination",
"AA3210010","10","100","製品構成メンテナンス（マルチカンパニー）の一覧","The list of product structure maintenance (Multi-Company)",
"AA3280010","10","100","製品構成コピー登録（マルチカンパニー）の画面リスト","The screen list of product structure copy register (Multi-Company)",
"AA3290010","10","100","製品構成一括置換（マルチカンパニー）の画面リスト","The screen list of product structure batch sub (Multi Company)",
"AP3030010","10","1000","工場間搬送指示書発行の画面リスト","The screen list of inter-plant transport issued instructions",
"AP3040010","10","100","工場間搬送出庫実績入力の親画面リスト","The parent screen list of inter-plant transport actual issue input",
"AP3040010","20","100","工場間搬送出庫実績入力のサブ2画面ロット別在庫リスト（上段）","The sub2 screen stock list by lot of inter-plant transport actual issue input (top)",
"AP3040010","21","100","工場間搬送出庫実績入力のサブ2画面出庫実績明細リスト（下段）","The sub2 screen actual issue detailed list of inter-plant transport actual issue input (bottom)",
"AP3010010","10","15","工場間搬送受入入力(不良理由コード一覧)","Inter-plant transport accept input (defective reason code list)",
"AP3020010","10","100","工場間搬送受入メンテナンスの「工場間搬送受入一覧」（上段）","The""inter-plant transport acceptance list"" (top) of  inter-plant transport accepted maintenance",
"AP3020010","11","100","工場間搬送受入メンテナンスの「使用子品目一覧」（下段）","The ""using component part list""(bottom) of inter-plant transport accepted maintenance",
"AP3020010","20","100","工場間搬送受入メンテナンスサブ1の「不良理由一覧」","The ""defective reason list""of inter-plant transport accepted maintenance sub1",
"AA0140020","10","100","外注単価一覧の画面リスト","The screen list of unit cost of sub order list",
"AA0140030","10","100","支給単価一覧の画面リスト","The screen list of unit cost of supply list",
"AA3140020","10","100","外注単価一覧の画面リスト","The screen list of unit cost of sub order list",
"AA3140030","10","100","支給単価一覧の画面リスト","The screen list of unit cost of supply list",
"AZ3050010","10","1000","一般検索 検索結果のリスト","The list of general retrieval result",
"KQ0100010","10","100","受注消費税率変更のリスト","The screen list of change of order tax",
"KQ3180010","10","100","受注消費税率変更のリスト","The screen list of change of order tax",
"KQ2110010","10","100","受注消費税率変更のリスト","The screen list of change of order tax",
"KQ1180010","10","100","受注消費税率変更のリスト","The screen list of change of order tax",
"KU0070010","10","100","出荷インボイス出力のリスト","The screen list of Shipment invoice output",
"KU1140010","10","100","出荷インボイス出力のリスト","The screen list of Shipment invoice output",
"KU0090010","10","100","出荷インボイス一覧のリスト","The screen list of Shipment invoice",
"AG0090010","10","100","ロット一覧のリスト","The screen list of lot",
"AC0160010","10","100","所要量CSV出力のリスト","The screen list of MR CSV output",
"KM0020010","10","100","見積登録のリスト","The screen list of plan register",
"KM0040010","10","100","案件一覧","The list of case ",
"VA0010010","10","1000","原価費目マスタメンテナンス","",
"VA0020010","10","1000","費目勘定科目マスタメンテナンス","",
"VA0030010","10","1000","賃率マスタメンテナンス","",
"VA0040010","10","1000","部門マスタメンテナンス","",
"VA0050010","10","1000","部門階層マスタメンテナンス","",
"VA0060010","10","1000","基準単価マスタメンテナンス","",
"VA0070010","10","1000","品目マスタメンテナンス","",
"VA0080010","10","1000","構成マスタメンテナンス","",
"VA0090010","10","1000","作業系列マスタメンテナンス","",
"VA0100010","10","1000","品目マスタ費用情報取込","",
"VA0110010","10","1000","配賦ルールマスタメンテナンス","",
"VA0120010","10","1000","配賦ルールマスタ取込","",
"VA0130010","10","1000","配賦グループマスタメンテナンス","",
"VA0140010","10","1000","配賦基準値マスタメンテナンス","",
"VA0150010","10","1000","配賦基準値アップロード","",
"VA0160010","10","1000","共通マスタメンテナンス","",
"VC0010010","10","1000","費用情報メンテナンス","",
"VD0010010","10","1000","配賦結果照会","",
"VD0020010","10","1000","原価メンテナンス","",
"VZ0020010","10","1000","処理ログ確認","",
"VZ0030010","10","1000","エラーデータ確認","",
"KU3150010","10","100","出荷インボイス出力のリスト","The screen list of Shipment invoice output",
"KU3160010","10","100","出荷インボイス一覧のリスト","The screen list of Shipment invoice",
"AD3150010","10","100","出来高作業指示強制完了一覧のリスト","",
"AD3120010","10","100","現品票印刷一覧のリスト","",
"AG3090010","10","100","ロット一覧のリスト","The screen list of lot",
"AC3180010","10","100","所要量CSV出力のリスト","The screen list of MR CSV output",
"VE0010010","10","1000","費目別総費用集計表CSV出力","",
"VE0020010","10","1000","費目別作業区別総費用集計表CSV出力","",
"VE0040010","10","1000","作業区品番別工数比較表CSV出力","",
"VE0050010","10","1000","直接製造部門配賦表CSV出力","",
"VE0060010","10","1000","作業区別直接部門配賦表CSV出力","",
"VE0070010","10","1000","得意先別売上・原価一覧表CSV出力","",
"VE0080010","10","1000","製品在庫表CSV出力","",
"VE0090010","10","1000","材料在庫表CSV出力","",
"VE0100010","10","1000","製品原価表CSV出力","",
"VE0110010","10","1000","製品原価表リストCSV出力","",
"VG0010010","10","1000","予算見積品目マスタメンテナンス","",
"VG0020010","10","1000","予算見積構成マスタメンテナンス","",
"VG0030010","10","1000","予算見積作業系列マスタメンテナンス","",
"VG0040010","10","1000","予算見積基準単価マスタメンテナンス","",
"VG0050010","10","1000","予算見積原価マスタメンテナンス","",
"VG0060010","10","1000","予算見積製品原価表リストCSV出力","",
"VD0030010","10","1000","原価明細一覧","",
"AD0130010","10","1000","日報入力","",
"AD3100010","10","1000","日報入力（マルチカンパニー版）","",
"AA3220010","10","100","全社共通製品構成メンテナンス（マルチカンパニー）の一覧","The list of all company product structure maintenance (Multi-Company)",
